identifier,videoFilename,inBundle,title,name,text,iconFilename,h
String,String,Integer,LocalizedString,LocalizedString,LocalizedString,String,String
dragonAttackFireball,hunterbasic.m4v,0,New Attack: Fireball,Fireball Attack,Tap repeatedly to deal damage.,icon_class_hunter_01.png,
dragonAttackFlamethrower,Warriorbasic.m4v,1,How To Attack,Flamethrower Attack,Hold and drag to deal damage.,icon_class_warrior_01.png,
dragonAttackLockon,sorcerer.m4v,0,New Attack: Lock On,Lock On Attack,Swipe to attack up to 3 targets.,icon_class_sorcerer_01.png,
aoeSpell,Fireball.m4v,0,Fireball,Fireball,Deals damage to all buildings in the affected area.,icon_AOE_01.png,
battlecrySpell,Battlecry.m4v,0,Battle Cry,Battle Cry,Increase the damage of this and the next dragon to attack,icon_battlecry_01.png,
chainLightningSpell,chainLightning.m4v,0,Chain Lightning,Chain Lightning,Strikes buildings with lightning that chains randomly,icon_chainlightning_01.png,
chargedShieldSpell,eruptiveShield.m4v,1,Explosive Shield,Explosive Shield,Absorbs damage until depleted then explodes dealing damage to nearby buildings,icon_chargedshield_01.png,
cloakSpell,Cloak.m4v,0,Cloak,Cloak,Dragon becomes invisible and cannot be targeted until it attacks,icon_invisibility_01.png,
curePoisonSpell,CurePoison.m4v,0,Cure Poison,Cure Poison,Removes poison.,icon_cure_01.png,
dodgeSpell,Evasion.m4v,0,Evasion,Evasion,Dragon moves quickly over buildings and have a chance to dodge incoming projectiles,icon_dodge_01.png,
energySyphonSpell,Vampirictouch.m4v,0,Vampiric Touch,Vampiric Touch,When active gain health and rage on building destruction,icon_syphon_01.png,
freezeAttackSpell,Freeze.m4v,0,Freeze,Freeze,Freezes all buildings in the affected area,icon_freeze_01.png,
frenzySpell,Frenzy.m4v,0,Havoc,Havoc,Dragon deals greatly increased damage with its attacks,icon_frenzy_01.png,
healDragonSpell,rejuvenate.m4v,0,Rejuvenate,Rejuvenate,Restores dragon's health over time.,icon_heal_01.png,
healingMarkSpell,Healingmark.m4v,0,Healing Mark,Healing Mark,Places a mark on a building that heals the Dragon that destroys it,icon_healingmark_01.png,
hoverSpell,video.m4v,0,Hover,Hover,Hover,icon_hover_01.png,
hurricaneSpell,Windwall.m4v,0,Wind Wall,Wind Wall,Deflects incoming projectiles,icon_windWall_01.png,
increaseRageGenerationSpell,video.m4v,0,More Rage,More Rage,Rage regenerates at faster rate,icon_rage_increase_01.png,
instantKillSpell,Deathgaze.m4v,0,Death Gaze,Death Gaze,Dragon's next attack deals enough damage to destroy most buildings instantly,icon_instakill_01.png,
invertSpell,Reverseprojectiles.m4v,0,Reverse Projectiles,Reverse Projectiles,Reflects incoming projectiles back onto the attackers,icon_projectile_01.png,
invincibleSpell,Invincibility.m4v,0,Invincibility Shield,Invincibility Shield,Dragon becomes invincible briefly,icon_invincible_01.png,
kamikazeSpell,SelfDestruct.m4v,0,Self Destruct,Self Destruct,Dragon self destructs and deals tremendous damage to every tower in the area,icon_self_destruct_01.png,
lockdownSpell,Lockdown.m4v,0,Lockdown,Lockdown,Disables a building until the next time it takes damage.,icon_lockdown_01.png,
entrapSpell,entrap.m4v,0,Entrap,Entrap,"Disables a building for a short duration, or until it takes damage",icon_lockdown_01.png,
shortCircuitSpell,Elementalmayhem.m4v,0,Elemental Mayhem,Elemental Mayhem,"Causes Storm towers, Lightning towers, Fire/Ice turrets to attack each other.",icon_mayhem_01.png,
speedBoostSpell,video.m4v,0,Speed Up,Speed Up,Speed Up,icon_speed_01.png,
stoneskinSpell,StoneskinShield.m4v,0,Stoneskin Shield,Stoneskin Shield,Greatly reduces damage taken.,icon_stoneskin_01.png,
summonAIBattleDragonSpell,Summonwarrior.m4v,0,Summon Warrior,Summon Warrior,Summons a spectral Warrior Dragon to fight for you.,icon_summon_dragon_01.png,
teleportSpell,video.m4v,0,Teleport,Teleport,Dragon teleports past an entire island,icon_speed_01.png,
intimidatingRoarSpell,IntimidatingRoar.m4v,0,Intimidating Roar,Intimidating Roar,Deals damage to buildings nearby and reduces their damage for entire fight,icon_intimidatingRoar_01.png,
thunderstormSpell,Thunderstorm.m4v,0,Thunderstorm,Thunderstorm,Summons a cloud that brings down lightning bolts which does damage over time,icon_thunderstorm_01.png,
sacrificeSpell,Sacrifice.m4v,0,Sacrifice,Sacrifice,Dragon takes damage and gains rage immediately,icon_sacrifice_01.png,
archerTower,ArrowTower.mp4,,,,,,
cannonTower,CannonTower.mp4,,,,,,
darkFlakTower,darkFlakTower.m4v,,,,,,
fireFlakTower,fireFlakTower.m4v,,,,,,
stormTower,StormTower.mp4,,,,,,
ballista,BallistaTower.mp4,,,,,,
mageTower,RedMageTower.mp4,,,,,,
mageBlueTower,BlueMageTower.mp4,,,,,,
trebuchet,Trebuchet.mp4,,,,,,
lightningTower,LightningTower.mp4,,,,,,
hogFarm,SheepFarm.mp4,,,,,,
woodFarm,LumberMill.mp4,,,,,,
stealEssenceSpell,stealEssence.m4v,0,Steal Essence,Steal Essence,Steal essence from the last tower your dragon destroyed. Generates rage when you steal a new spell,icon_stealEssence_01.png,
iceTurret,IceTurret.mp4,0,,,,,
fluxSpell,spellFlux.m4v,0,Spell Flux,Spell Flux,Explodes one tower and damages nearby towers,icon_flux_01.png,
frozenTombSpell,FrozenTomb3.m4v,0,Frozen Tomb,Frozen Tomb,Freezes towers and gain shield based on the number of hit towers.,icon_frozenTomb_01.png,
galvanicOverloadSpell,GalvanicOverload.m4v,0,Galvanic Overload,Galvanic Overload,High damage to one building.  Killing building allows to recast and gain rage at cost of health.,icon_galvanic_initial_01.png,
seethingSparkSpell,SeethingSpark.m4v,0,Seething Spark,Seething Spark,"First cast increases damage.  Second cast discharges, damaging and stunning buildings",icon_seething_spark_initial_01.png,
risingPhoenixSpell,RisingPhoenix3.m4v,0,Rising Phoenix,Rising Phoenix,"If dragon dies during spell duration, explodes back to life and damages towers.",icon_risingphoenix_01.png,
invertSpellReverse,Reverseprojectiles.m4v,0,Invert,Invert,Reflects incoming projectiles back onto the attackers for short duration,icon_projectile_01.png,
fireTurret,fireTurret.m4v,0,,,,,
heatBlastShieldSpell,heatBlastShield.m4v,0,Heat Shield,Heat Shield,Reduces incoming damage and instantly heals for a small amount. (Mehaten only) If struck by a Spitfire Turret the Solar Energy bar will charge by 25%.,icon_heatshield_01.png,
heatedPiercingBreathSpell,heatedPiercingBreathSpellv2.m4v,0,Heated Breath,Heated Breath,Flamethrower deals more damage for duration. (Mehaten only) Any building destroyed while active will grant 2x Solar Energy.,icon_superheatedbreath_01.png,
nocturnalFissureSpell,nocturnalFissureSpellv2.m4v,0,Nocturnal Fissure,Nocturnal Fissure,"Opens a vortex for 4 seconds which destroys projectiles. If empowered by Nightfall, channels a portion of that damage into health.",icon_nocfissure_01.png,
umbralSpikeSpell,umbralSpikeSpellv2.m4v,0,Umbral Spike,Umbral Spike,A shadowy spike emerges from the ground and pierces the targeted tower destroying it.,icon_umbralspike_01.png,
desiccatingSandSpell,desiccatingSandSpellv2.m4v,0,Desiccating Sand,Desiccating Sand,Launches choking sand that does damage on contact and prevents it from firing or blocking all spells until it takes damage.,icon_dessicatingsand_01.png,
crumbleToDustSpell,crumbleToDustSpellv3.m4v,0,Crumble to Dust,Crumble to Dust,"Turns the earth at the base of the island's towers into swirling sand that creeps up the sides of each tower. Affected towers deal reduced damage and take increased damage. A second cast on the same towers turns the towers themselves to sand, dealing massive damage!",icon_crumbletodust_01.png,
radianceSpell,radianceSpell.m4v,0,Radiance,Radiance,Incinerates any projectiles currently in air and heals a moderate amount. Attack changes to Solar Breath which deals increased damage.,icon_glowingradiance_01.png,
nightFallSpell,nightFallSpellv2.m4v,0,Nightfall,Nightfall,"Harness shadowy energies to empower the next Ability used and, as a bonus, increase next Lock-On Attack's damage by 50%.",icon_nightfall_01.png,
shadowApophetSpell,shadowApophetv2.m4v,0,Apophet's Shadow,Apophet's Shadow,Increases Lock-On damage and returns 33% of damage dealt back to Apophet as health healed. Apophet loses these bonuses if shadow is killed.,icon_apophetshadow_01.png,
borrowTimeSpell,borrowTimeSpellv3.m4v,0,Borrowed Time,Borrowed Time,"Build up Temporal Energy over time. When reduced to 0 health, her ghost will continue to fly forward, allowing you to attack but not use Abilities.",icon_borrowedtime_01.png,
timeShiftSpell,timeShiftSpellv2.m4v,0,Time Shift,Time Shift,"Transform into a cloud, draining Temporal Energy. She cannot attack but can still cast Abilities. Player can cancel this spell by attacking.",icon_timeshift_01.png,
iceShockSpell,iceShock.m4v,0,Ice Shock,Ice Shock,Penetrates mage towers and freezes and damages buildings in affected area,icon_freeze_01.png,
crystallineShieldSpell,crystallineShieldSpell.m4v,0,Crystalline Shield,Crystalline Shield,"Several shards of ice protect you, sacrificing themselves to stop projectiles and reducing damage from beam attacks",icon_crystallineShield_01.png,
celestialDanceSpell,celestialDanceSpell.m4v,0,Celestial Dance,Celestial Dance,"Alters the nature of your other spells to heal or generate rage, based on the Light or Dark version of your spell",icon_celestialDance.png,
dreadfulRoarSpell,dreadfulRoarSpell.m4v,0,Dreadful Roar,Dreadful Roar,Inflict nearby buildings with Gloom Clouds and increase their damage taken,icon_dreadfulRoar.png,
maleficBreathSpell,maleficBreathSpell.m4v,0,Malefic Breath,Malefic Breath,Dragon's flamethrower attack will inflict poisonous Gloom Clouds on targeted buildings,icon_maleficBreath.png,
northernLightsSpell,northernLightsv2.m4v,0,Northern Lights,Northern Lights,"Invincible shield that creates Heal Marks or Rage Marks on towers when destroyed, cycled with Celestial Dance.",icon_northernLights_light.png,
southernCrossSpell,southernCrossSpell.m4v,0,Southern Cross,Southern Cross,"Deals damage to buildings and restore either Health or Rage, cycled with Celestial Dance.",icon_southernCross_light.png,
southernCrossDarkSpell,southernCrossDark.m4v,0,Southern Cross (Dark),Southern Cross (Dark),Deals damage to buildings and restore Rage.,icon_southernCross_dark.png,
southernCrossLightSpell,southernCrossSpell.m4v,0,Southern Cross (Light),Southern Cross (Light),Deals damage to buildings and restore either Health.,icon_southernCross_light.png,
cosmicEnergySpell,cosmicEnergySpell.m4v,0,Cosmic Energy,Cosmic Energy,"Passive: When Celestial Dance is used, removes all debuffs if HP is higher than 50%",icon_cosmicEnergy.png,
dayBreakSpell,radianceSpell.m4v,0,Daybreak,Daybreak,Passive: Absorb solar energy from destroyed buildings,icon_daybreak_01.png,
summonWhiteDragonSpell,Summonwarrior.m4v,0,Summon Warrior,Summon Warrior,Summons a spectral Warrior Dragon to fight for you.,icon_summon_dragon_01.png,
chaosSpell,Chaos.m4v,0,Chaos,Chaos,Dragon deals greatly increased damage with its attacks,icon_frenzy_01.png,
devourHopeSpell,devourHope.m4v,0,Devour Hope,Devour Hope,Receive healing from Gloom Clouds,icon_devourHope.png,
gloomAndDoomSpell,gloomAndDoom.m4v,0,Doom Chains,Doom Chains,Buildings that have Gloom Clouds are shackled and unable to attack,icon_gloomAndDoom.png,
frostbiteSpell,frostbite.m4v,0,Frostbite,Frostbite,Passive: Fireball attacks embed Icy Shards in buildings that increase damage inflicted.,icon_frostbite.png,
shattershardSpell,shattershard.m4v,0,Shattershard,Shattershard,Shatter any frozen buildings to deal damage and regenerate Hunter ammo.,icon_shatterShard.png,
fireShieldSpell,fireShield.m4v,0,Fire Shield,Fire Shield,Reduces incoming damage by 60% and heals for 10%,icon_fireShield_01.png,
whiteSacrificeSpell,whiteSacrifice.m4v,0,Sacrifice,Sacrifice,Dragon takes damage and gains rage immediately,icon_sacrifice_01.png,
superRejuvenateSpell,superRejuvenate.m4v,0,Super Rejuvenate,Super Rejuvenate,Restores dragon's health over time.,icon_superRejuvenate_01.png,
superHeatedBreathSpell,superHeatedBreath.m4v,0,Superheated Breath,Superheated Breath,Flamethrower deals more damage for duration. (Mehaten only) Any building destroyed while active will grant 2x Solar Energy.,icon_superheatedbreath_01.png,
earthquakeSpell,earthquake.m4v,0,Earthquake,Earthquake,Large area effect spell that damages and prevents affected towers from attacking. ,icon_earthquake.png,
noxiousVinesSpell,noxiousVines.m4v,0,Noxious Vines,Noxious Vines,Grow choking vines that damage and then immobilize towers until affected towers take damage.,icon_noxiousVines.png,
seismicScreechSpell,seismicScreech.m4v,0,Seismic Screech,Seismic Screech,Damages towers. Affected towers deal reduced damage.,icon_seismicScreech.png,
shieldBlastSpell,shieldBlast.m4v,0,Shield Blast,Shield Blast,"Absorbs all damage until depleted and then explodes, dealing damage to nearby buildings.",icon_shieldBlast.png,
tectonicTombSpell,tectonicTomb.m4v,0,Tectonic Tomb,Tectonic Tomb,Traps towers in earthen crust and damages them. Also creates a shield that absorbs damage.,icon_tectonicTomb.png,
uprootSpell,uproot.m4v,0,Uproot,Uproot,Wooden spike destroys the targeted tower and restores health.,icon_Uproot.png,
enfeebleSpell,enfeeble.m4v,0,Enfeeble,Enfeeble,"Increases damage done to towers, reduces tower attack power and second cast destroys buildings affected.",icon_enfeeble.png,
resurrectionSpell,resurrection.m4v,0,Resurrection,Resurrection,"If dragon dies during spell duration, explodes back to life and damages towers. Has a cooldown between uses.",icon_resurrection_01.png,
elementalBarrierSpell,elementalBarrier.m4v,0,Elemental Barrier,Elemental Barrier,Absorb damage from elemental tower attacks and convert a portion of it into health.,icon_elementalBarrier.png,
dissipateSpell,dissipate.m4v,0,Dissipate,Dissipate,"Cloak and recover Hunter ammo. While cloaked, dragon moves slower. Upon uncloaking, an explosion damages nearby towers.",icon_dissipate.png,
berserkSpell,berserk.m4v,0,Berserk,Berserk,"Dragon loses health, but increases damage output and rage generation. Destroying towers restores health during spell.",icon_berserk.png,
whiteChainLightningSpell,thunderbolt.m4v,0,Thunderbolt,Thunderbolt,Strikes buildings with lightning that chains randomly,icon_chainlightning_01.png,
isolationSpell,isolation.m4v,0,Isolation,Isolation,Briefly weaken chosen tower and greatly weaken nearby towers.,icon_isolation.png,
starburnSpell,starburn.m4v,0,Starburn,Starburn,"Passive: At low dragon HP, attacks embed fire that increase damage inflicted.",icon_Starburn.png,
novaSpell,nova.m4v,0,Nova,Nova,"Deals area damage and gain short invincibility, health and rage. Can be used once only.",icon_Nova.png,
lightSpeedSpell,lightSpeed.m4v,0,Light Speed,Light Speed,Deals area damage and gain reduced Hunter ammo cost at reduced damage.,icon_lightSpeed.png,
flashSpell,Flash.m4v,0,Flash,Flash,Blinds towers to dodge all non-beam attacks. Dragon moves slower.,icon_flash.png,
hellspawnSpell,hellspawn.m4v,0,Summon Hellspawn,Summon Hellspawn,Summons a Hellspawn Warrior Dragon to fight for you.,icon_summonHellspawn.png,
extractEssenceSpell,extractEssence.m4v,0,Extract Essence,Extract Essence,Extract essence from the last tower your dragon destroyed. Generates rage when you steal a new spell.,icon_Extract_Essence.png,
consumeSpell,consume.m4v,0,Consume,Consume,Consumes all Hunter ammo then heals based on Hunter ammo spent.,icon_consume.png,
dragonShieldSpell,dodoGuardian.m4v,0,Dodo Guardian,Dodo Guardian,An invulnerable passive summoned dodo guardian. Absorbs 33% of damage taken and increases rage generation by 20%.,icon_dodoGuardian_01.png,
lethalBarrierSpell,lethalBarrier.m4v,0,Lethal Barrier,Lethal Barrier,Absorbs damage until depleted then explodes dealing damage to nearby buildings,icon_chargedshield_01.png,
ashenBreathSpell,ashenBreath.m4v,0,Ashen Breath,Ashen Breath,Attack inflicts clouds of decay on targeted buildings for short duration.,icon_pestilentBreath_01.png,
mysticWindSpell,mysticWinds.m4v,0,Mystic Winds,Mystic Winds,Deflects incoming projectiles and mage tower shots for 4.5 seconds,icon_mysticalWinds_01.png,
northernLightsDarkSpell,northernLightsDark.m4v,0,Northern Lights (Dark),Northern Lights (Dark),"Become invincible briefly, then release a wave of energy that creates Rage Marks on towers.",icon_northernLights_dark.png,
elementalFluxSpell,spellFlux.m4v,0,Elemental Flux,Elemental Flux,Next attack kills one building instantly with an elemental blast.,icon_elementalFlux_01.png,
whiteInstantKillSpell,deathGazeWhite.m4v,0,Death Stare,Death Stare,Dragon's next attack deals enough damage to destroy most buildings instantly,icon_instakill_01.png,
northernLightsLightSpell,northernLightsLight.m4v,0,Northern Lights (Light),Northern Lights (Light),"Become invincible briefly, then release a wave of energy that creates Healing Marks on towers.",icon_northernLights_light.png,
staticShieldSpell,staticShield.m4v,0,Static Shield,Static Shield,"Absorbs all damage until depleted and then explodes, dealing damage to nearby buildings.",icon_shieldBlast.png,
fullMoonSpell,fullMoon.m4v,0,Full Moon,Full Moon,"Dragon loses health, but increases damage output and rage generation. Destroying towers restores health during spell.",icon_full_moon.png,
stoneformSpell,stoneform.m4v,0,Stoneform,Stoneform,Greatly reduces damage taken.,icon_stoneform.png,
feralRageSpell,feralRage.m4v,0,Feral Rage,Feral Rage,Dragon has increased rage regeneration.,icon_rage_passive.png,
atlasIntroVideo,AtlasIntroVideo.m4v,0,What is Atlas,Atlas,Discover the world!,icon_hud_worldmap.png,
reanimateSpell,reanimate.m4v,0,Reanimate,Reanimate,"If dragon dies during spell duration, explodes back to life and damages towers. Has a cooldown between uses.",icon_reanimate.png,
talonFrenzySpell,talonFrenzy.m4v,0,Talon Frenzy,Talon Frenzy,"For a short time, dragon deals greatly increased damage with its attacks",icon_talon_frenzy.png,
corrosiveBrineSpell,corrosiveBrine.m4v,0,Corrosive Brine,Corrosive Brine,Fireball attacks increase damage dealt to buildings.,icon_corrosiveBrine.png,
lionsRageSpell,lionsRage.m4v,0,Lion's Rage,Lion's Rage,"Passive: At low dragon HP, attacks deal massively increased damage.",icon_lions_rage.png,
lightningFamiliarSpell,lightningFamiliar.m4v,0,Lightning Familiar,Lightning Familiar,Passive: Summons a lightning dragon that increases rage generation and decreases damage taken.,icon_lightningFamiliar_01.png,
tidalSurgeSpell,tidalSurge.m4v,0,Tidal Surge,Tidal Surge,Damages a building and restores health.,icon_tidalSurge.png,
riptideSpell,riptide.m4v,0,Riptide,Riptide,"Cloak briefly. Upon uncloaking, damage nearby towers.",icon_riptide.png,
shieldAssaultSpell,shieldAssault.m4v,0,Shield Assault,Shield Assault,"While active, increases damage dealt and decreases damage received.",icon_shield_assault_01.png,
blazingShieldSpell,blazingShield.m4v,0,Blazing Shield,Blazing Shield,Reduces incoming damage and restores health.,icon_blazing_shield.png,
absorbMagicSpell,absorbMagic.m4v,0,Absorb Magic,Absorb Magic,Decrease all damage received and absorbs mage supershot to gain rage.,icon_absorb_magic.png,
frostShieldSpell,frostShield.m4v,0,Frost Shield,Frost Shield,Blocks all projectile damage. Reduces beam attack damage.,icon_frost_shield.png,
soulDevourSpell,soulDevour.m4v,0,Soul Devour,Soul Devour,"While active, gain health and rage for each tower destroyed.",icon_soul_devour.png,
lightningStormSpell,Lightningstorm.m4v,0,Lightning Storm,Lightning Storm,Summons a cloud that brings down lightning bolts which does damage over time,icon_thunderstorm_01.png,
bloodFurySpell,bloodFury.m4v,0,Bloodfury,Bloodfury,Gains Rage but slows regeneration rate. Gain health on building destruction.,icon_bloodfury.png,
adaptiveBreathSpell,adaptiveBreath.m4v,0,Adaptive Breath,Adaptive Breath,Activate to cycle between three breath modifiers.,icon_adaptiveBreath.png,
adaptiveResistSpell,adaptiveResist.m4v,0,Adaptive Resist,Adaptive Resist,Change Resist type on use and gain small amount of rage.,icon_adaptive_resist.png,
seekerShotsSpell,seekerShots.m4v,0,Seeker Shots,Seeker Shots,Instantly shoot multiple magic projectiles at targets in front.,icon_seeking_shots.png,
iceFlakTower,iceFlakTower.m4v,,,,,,
warcrySpell,Warcry.m4v,0,War Cry,War Cry,Increase the damage of this and the next dragon to attack.,icon_battlecry_01.png,
wintersBiteSpell,wintersBite.m4v,0,Winter's Bite,Winter's Bite,Dragon's flamethrower attack deals increased damage and freezes buildings.,icon_wintersBite_01.png,
summersPurificationSpell,summersPurification.m4v,0,Summer's Purification,Summer's Purification,Heavily damage all towers in target area. Restore health for each tower destroyed,icon_summersPurification_01.png,
regenerateSpell,regenerate.m4v,0,Regenerate,Regenerate,Restores health over time.,icon_regenerate_01.png,
autumnsReapSpell,autumnsReap.m4v,0,Autumn's Reap,Autumn's Reap,Increases attack & rage generation. Destroying towers grants health.,icon_autumnsReap_01.png,
ghostfireBlastSpell,ghostfireBlast.m4v,0,Ghostfire Blast,Ghostfire Blast,Damage and disable all buildings in the affected area,icon_ghostfireBlast_01.png,
solarStrikeSpell,solarStrike.m4v,0,Solar Strike,Solar Strike,Heavily damages target tower.,icon_solarStrike_01.png,
vanishSpell,vanish.m4v,0,Vanish,Vanish,Dragon becomes invisible and cannot be targeted until it attacks,icon_vanish_01.png,
ghostfireWreathSpell,ghostfireWreath.m4v,0,Ghostfire Wreath,Ghostfire Wreath,Absorbs all incoming damage and projectiles.,icon_ghostfireWreath_01.png,
springsRenewalSpell,springsRenewal.m4v,0,Spring's Renewal,Spring's Renewal,"Mark target tower. When marked tower is destroyed, gain health and rage. ",icon_springsRenewal_01.png,
bellyFlopSpell,bellyFlop.m4v,0,Belly Flop,Belly Flop,Dragon self destructs and deals tremendous damage to every tower in the area,icon_hippo_destruct_01.png,
whiteSuperRejuvenateSpell,whiteSuperRejuvenate.m4v,0,Super Rejuvenate,Super Rejuvenate,Restores a large amount of health over time,icon_superRejuvenate_01.png,
leechEssenceSpell,leechEssence.m4v,0,Leech Essence,Leech Essence,Leech essence from the last tower your dragon destroyed. Generates rage when you steal a new spell.,icon_leechEssence.png,
windFlakTower,windFlakTower.m4v,,,,,,
heatstrokeSpell,heatstroke.m4v,0,Heatstroke,Heatstroke,Fireball attack causes buildings to take damage over time.,icon_heatstroke.png,
everlastingHuntSpell,everlastingHunt.m4v,0,Everlasting Hunt,Everlasting Hunt,"If dragon dies during spell duration, explodes back to life and damages towers.",icon_everlastingHunt.png,
mysticBarrageSpell,mysticBarrage.m4v,0,Mystic Barrage,Mystic Barrage,Dragon deals greatly increased damage with its attacks,icon_mysticBarrage.png,
explosiveAegisSpell,explosiveAegis.m4v,0,Explosive Aegis,Explosive Aegis,Shields dragon. Next cast damages and debuffs towers.,icon_explosiveAegis.png,
stormShieldSpell,stormShield.m4v,0,Storm Shield,Storm Shield,Absorbs damage until depleted then explodes damaging buildings,icon_stormShield.png,
rampageSpell,rampage.m4v,0,Rampage,Rampage,Increased attack & rage generation. Destroying towers grants health.,icon_rampage.png,
magicBarrierSpell,magicBarrier.m4v,0,Magic Barrier,Magic Barrier,Shields dragon from all damage for a short duration.,icon_impenetrableAura.png,
adaptiveFlakResistSpell,adaptiveFlakResist.m4v,0,Adaptive Flak Resist,Adaptive Flak Resist,Changes Resist type on use and restores a small amount of rage.,icon_adaptiveFlakResist.png,
ferociousBarrierSpell,ferociousShield.m4v,0,Ferocious Shield,Ferocious Shield,Absorbs damage then temporarily increases attack power after shield duration,icon_ferociousShield.png,
bloodEssenceSpell,bloodEssence.m4v,0,Blood Essence,Blood Essence,Gain rage and Consume spell when dragon destroys a tower.,icon_bloodEssence.png,
heavenlyWindsSpell,heavenlyWinds.m4v,0,Heavenly Winds,Heavenly Winds,Reflects incoming projectiles back onto the attackers,icon_heavenlyWinds.png,
earthFamiliarSpell,earthFamiliar.m4v,0,Earth Familiar,Earth Familiar,Passive: Summons a Dragon familiar that increases rage generation and decreases damage taken.,icon_apophetshadow_01.png,
umbralSpikeWhiteSpell,umbralSpikeWhite.m4v,0,Umbral Spike,Umbral Spike,Damages small target area and restores health.,icon_umbralspike_01.png,
syphonStrikeSpell,syphonStrike.m4v,0,Syphon Strike,Syphon Strike,Heavily damages target tower and restores a large amount of HP.,icon_syphonStrike_01.png,
echoingBlastSpell,echoingBlast.m4v,0,Echoing Blast,Echoing Blast,Damages nearby towers and restores health. Provides brief invincibility.,icon_echoingBlast.png,
shadowDispersalSpell,shadowDispersal.m4v,0,Shadow Dispersal,Shadow Dispersal,Cloaks briefly. Damages buildings upon uncloaking.,icon_shadowDispersal_01.png,
furyOfTheWastesSpell,furyOfTheWastes.m4v,0,Fury of the Wastes,Fury of the Wastes,Passive: Dragon restores health and increases damage over time.,icon_furyOfTheWastes.png,
rainbowShotSpell,rainbowShot.m4v,0,Rainbow Shot,Rainbow Shot,Freezes and damages buildings in the affected area.,icon_rainbowShot.png,
elementalBubbleSpell,elementalBubble.m4v,0,Elemental Bubble,Elemental Bubble,Absorbs damage from elemental towers and converts a portion of it into health.,icon_elementalBubble.png,
etherealChainsSpell,etherealChains.m4v,0,Ethereal Chains,Ethereal Chains,Disables towers in target area until they take damage.,icon_etherealChains.png,
heroicSacrificeSpell,heroicSacrifice.m4v,0,Heroic Sacrifice,Heroic Sacrifice,Dragon self-destructs and deals tremendous damage to every tower in the area.,icon_heroicSacrifice.png,
cripplingChillSpell,cripplingChill.m4v,0,Crippling Chill,Crippling Chill,Freezes and damages buildings in the target area.,icon_cripplingChill.png,
energizeSpell,Sacrifice.m4v,0,Energize,Energize,Dragon takes damage and instantly gains rage.,icon_energize.png,
